{
  "schema_version": "0.1.0",
  "dataset_id": "golden-two-costs",
  "work_item_id": "ticket-7",
  "title": "Synthetic two-call conformance Work Item",
  "scope": { "revision": "1", "description": "Illustrative work only; no real accepted delivery or calibrated point scale is asserted" },
  "acceptance_criteria": ["Demonstrate joining a prior local point estimate to observed cost"],
  "outcome": { "status": "accepted", "recorded_at": "2026-09-06T11:00:00Z", "summary": "Synthetic fixture outcome" },
  "attempts": [{ "attempt_id": "attempt-1", "status": "accepted", "started_at": "2026-09-06T10:00:00Z", "ended_at": "2026-09-06T11:00:00Z", "observation_ids": ["example-call-a", "example-call-b"] }],
  "estimates": [{ "estimate_id": "estimate-1", "estimate_version": 1, "scope_revision": "1", "created_at": "2026-09-06T09:00:00Z", "timing": "pre_execution", "information_basis": "specification_only", "estimator": "synthetic fixture", "point_estimate": { "scale_id": "illustrative-local-scale", "scale_version": "1", "kind": "decimal", "value": "5" }, "rationale": "Arbitrary synthetic point value for interchange testing; no predictive claim" }]
}
